src_id,cn_text,vi_text
0,"写给自己的第1封信
不管遇到了什事，都不应该
世上除了生死，
都是小事。
每天微笑吧，
从今天开始，
无论今天发生多么糟糕的事，
都不要自己为难自己；
么烦心事，
因为有明天，
感到悲伤。
今天是你往后日子里最年轻的一天了，
今天永远
只是起跑线。
写给自己的第2封信
和生生不息的希望。
不管前方的路有
总会有不期而遇的温暖，
人生，
多苦，
不管多么崎岖不平，都比站在原地更接近幸福。
只要走的方向正确，
写给自己的第3封信
时时刻刻要求自己做到百分之百的超出期望值。但
你是个要强的人，
不要太着急，
是苛求并不是个好现象，
请允许自己犯错。
你并不是天才，
你的努力，
时间都会帮你兑现。
","



+
Cóng jintian kaishÌ, mẽitiãn wéixiào ba, shìshàng chúle shengsĩ, döu shì xiÄoshì. Bùguăn

yù dàole shénme fánxin shì, döu bùyào zÌjš wéinán zÌjš; wúlùn Jintian fasheng duome zaogao
de shì, dou bù yìng gãi gặndào beishäng, Jintian shì n văng hòu tìzi lÄ Zuì niánging de yItianle,

yinvèi yÖu míngtian, jIntian yóngyuĂn zhÍshì gïpšoxiần.
Bức thư viết cho chính mình số 001
Kế từ hôm nay, mỗi ngày bạn hãy cười lên! Trên đời này, thực ra trừ việc sinh tử
là quan trọng ra, còn lại đều là chuyện nhỏ. Cho dù gặp phải chuyện gì đi chăng nữa
thì cũng đừng tự làm khố mình, cho dù xảy ra chuyện rắc rối đến thế nào đi nữa cũng
-

chẳng cần phải đau lòng. Hôm nay là n,fDrz`JẨy bạn trẻ nhất so với tất thảy những I.lgẺ""5Ì}7J
tháng nỗ lực về sau rồi. Bởi vì luôn còn có ngày mai, hôm nay mãi mãi chỉ là vạch kẻ
xuất phát cho chuỗi hành trình sau này.



1ìf’:11sl1_ẽtt1ê£g,i zðng huì yóu bù qĩ ér yù de wennuän, hé shengsheng bù xI de xiwàng.


Bùguán giánfang de lù vðu duo kũ, zhiyào zóu de fangxiàng zhèngquè, bùguăn duome gíqu
bùpíng, dou bĩ zhàn zàiyuán dì gèng Jiejìn xìngfú.

Bức thư viết cho chính mình số 002
Đời người luôn có những điều ấm áp không mong mà tới cùng với cả những hi
vọng không ngừng lớn lên. Cho dù con đường phía trước có biết bao khố ải, chỉ cần
hướng đi chính xác thì dù trên đường đi đó có bao nhiêu chông gai, gập ghềnh cũng
còn gần với bến bờ hạnh phúc hơn rất nhiều so với việc chỉ đứng mãi ở vạch xuất phát.



.. __


7

"
1,"写给自己的第4封信
有些事不
人也在变。
生命是一场无法回放的绝版电影，
时间在变，
管你如何努力，
不是爱，
回不去就是回不去了。
世界上最远的距离，
不是
渐渐变得陌生。
而是熟悉的人，
写给自己的第5封信
很多时候你在奋力拼搏后未能获得你想要的，
并不是因为你不配，
而
将如此努力的自己继续保持下
只是咬紧牙关，
只是时机未到，
你要做的，
仅此，
而已。
","
N shìgè yàogiáng de rén, shí shíkè kè yaoqtú zÌjš zuò dào băifenzhibii de chaochu
givàngzhí. Dànshì keqiú bìng bùshì gè hão xiànxiàng, nĂ bìng bùshì tiancái, qšng vúnxủ zìJ\
fàncuò. Bùyào tài zhãojí, nă de núh, shíjian duhuì bang nă dubxần.

Bức thư viết cho chính mình số 003

Bạn là một người vô cùng mạnh mẽ, bất kế lúc nào cũng phải tự bắt mình làm
được trọn vẹn 100% những Kì vọng của bản thân đặt ra. Nhưng nghiêm khắc không
phải là điều lúc nào cũng tốt, bạn không phải thiên tài, vì thế hãy cho phép mình
phạm sai lầm. Đừng quá vội vàng, thời gian sẽ giúp bạn trưởng thành cùng với những
nỗ lực của chính mình.


lh,
Shíjian zài biàn, rén yẽ zài biền. Shengmìng shì y¡ chăng wúfã huífAàng de Ju@băn
diànyïng, vöuxie shì bùguăn tử rúhé nủiì, huí bù qù jiùshì huí bù qùle. Shijiè shàng zui vuăn
de Jùlí, bùshì ài, bùshì hèn, ér shì shúx1 de rén, jiÀnjiàn biàn dé mòsheng.

$
Bức thư viết cho chính mình số 004
Thời gian thay đối, lòng người cũng đối thay, cuộc sống của chúng ta đều tựa
như một bộ phim điện ảnh không có suất chiếu lại. Có những thứ dù chúng ta có nỗ
lực cố gắng đến thế nào đi nữa thì cũng chẳng bao giờ trở lại như xưa. Cũng như vậy
mà suy, trên đời này, khoảng cách xa nhất không phải là yêu cũng chẳng phải là hận
^-A^
mà đôi khi đơn giản chỉ là những người quen biết nhau dần trở nên xa lạ đến đáng

sợ với nhau.






%›


Hềnduo shíhòu nỉ zài fènh pinbó hòu wèi néng huòdé nặ xiăng vào de, bìng bùshì
yinvèi nš bùpềi, ér zhishlì shíjt wèi dào, nš vào zuò de, zhïshì văo lïn yáguan, JiÀng rúcÍ nùl de
zìji jìxù băochí xiàqù, jïn c, ryt.
Bức thư viết cho chính mình số 005
Có nhiều lúc bạn đã cố gắng hết sức bình sinh và nỗ lực không mệt mỏi nhưng
vẫn chưa thể có được những thứ bạn muốn, không phải vì bạn không xứng mà đôi
8

"
2,"写给自己的第6封信
大概都是这样吧一—奇迹并非是上天赐予某人原本不应获
所谓奇迹，
却从不缺席。
它只会迟到，
而是对于勤奋者姗姗来迟的褒奖，
得的东西，
写给自己的第7封信
“我始终相信，-
一定有另一
在这个世界上，
宫崎骏在他的电影里说:
我们每个
个自己，在做着我不敢做的事，在过着我想过的生活。
其实，
没有我们过
就没有我们不敢做的事，
只要我们愿意，
人就是另一个自己，
不上的生活。
写给自己的第8封信
学姐们
或许你会羡慕上司的房子、
车子，
或许你感觉自己一无所有，
","

khi chỉ là thời cơ chưa đến. Những thứ bạn cần phải làm chỉ đơn giản là cắn chặt răng,
tiếp tục để bản thân mình vẫn cố gắng như thế, nỗ lực hơn thế nữa, chỉ có vậy thôi.





Suðwèi gfj, dàgài döu shì zhèyàng ba——-dqfji bìngfei shì shàngtiãn cìyU möu rén
yuánbšn bù yìng huòdé de dongxi, ér shì duìyú qínfèn zhẽ shãn shan lái chí de baojiĂng, ta
zhï huì chídào, què cóng bù quexí.

Bức thư viết cho chính mình số 006

Cái gọi là kì tích, có thể hiểu nôm na như thế này: Kì tích không có nghĩa là
những thứ mà thượng đế ban tặng cho một ai đó không đáng được nhận, mà thực ra
Ă
là những giải thưởng dành cho người chăm chỉ được gửi đến chầm chậm, chậm đến
nỗi mà chính họ cũng không biết. Kì tích chỉ là đến sớm hay muộn chứ trước giờ chưa
bao giè
giờ “vắ
váng mặt:








ø
_ .



`
Gõng gí jùn zài tã de diànyïng H shuõ: “Wð shïzhöõng xiangxìn, zài zhège shìjiè
..
shàng, yidìng yðu lìng yigè zÌJjš, zài zuòzhe wð bù gắn zuò de shì, zZàiguòzhe wÖ xiăngguò de
~ Z ” # z v vọ ` Z .N ` ` - ` N MÁ ` v ` `N .. . AM v
shenghuó.  Qíshí, vðmen mẽi gèrén JiùshÌ lìng yigè zÌjÌ, ZhÌyào wömen yuànyÌ, llù méiyÖu
shẽnghuó.”.
wðmen bù găn zuò de shì, métyÓu wÖmenguò bu shàng de shenghuó.
Bức thư viết cho chính mình số 007
Miyazaki Hayao (Cung Khi Tuấn) đã từng nói như thế này trong phim của ông
ấy: “Từ trước tới nay, tôi đều tin rằng trên đời này nhất định có một “tôi” khác tồn tại,
dám làm những thứ chúng ta không dám làm, sống một cuộc sống chúng ta không
dám sống”. Thực ra thì ai trong chúng ta đều có một bản ngã khác của chính mình, chỉ
cần chúng ta thực sự muốn, chẳng có gì mà chúng ta không dám làm, chẳng có khó

khăn cuộc sống nào không vượt qua được.




9

"
3,"只要努力，
其实你不用羡慕这些，
岁月都会带
所有的一切，
的钻石耳钉。
却是他们再也无法拥有的。
而你的年轻岁月，
给你。
写给自己的第9封信
都是你以前的种种行为造成的。如果你讨厌自己的现
你现在的结果，
都有一个不努力
因为每一个你不满意的现在，
更应该反思一下自己。
的曾经。
写给自己的第10封信
正是发奋努力的时候。
每一个
年轻正是吃苦的时候，
你一定要相信，
必有加倍的奖赏。
发奋努力的背后，
今天的生活是由三年前决定的，
但是
如果你今天还过着和三年前一样的生活，
那么三年后的你仍将如此。
","
Huòxúủ nÏ gănjué zÙÏ yvrwúsuöyóÓu, huòxúủ nỉ huì xiànmù shàngsi de fángzi, chezi, xuế
Jišmen de zuànshí šr díng. Qíshí n bùyÒòng xiànmù zhèxie, zhỉyÀo nủlì, suóyÓu de yigiè,
suìyuè dũhul dài gẽi nš. Ér nĂ de niángïng suìyuè, què shì tãmen zài yš wúfš yõngyöu de.
Bức thư viết cho chính mình số 008

Có lẽ đôi lúc bạn cảm thấy mình chẳng có gì, bạn ngưỡng mộ căn nhà, xe sang
của cấp trên mình, bạn thèm muốn đôi khuyên tai kim cương chị cùng trường đang
đeo. Thực ra bạn không cần phải đi ngưỡng mộ những thứ này, chỉ cần bạn nỗ lực,
thời gian sẽ mang tất cả đến cho bạn. Ngược lại, những năm tháng thanh xuân nỗ lực
của bạn, lại là thứ họ chẳng bao giờ cảm nhận được.


&,
N xiànzài de jiéguð, dou shì nặ yigián de zhóngzhòng xíngwéi zàochéng de. Rúguö nÏ
tăoyàn ZÌjŸ de xiÀnzài, gèng yĩnggai fĂnsi yIxiÀ ZÌJjÌ. Vinwèi mềi vigè nă bù mănyì de xiànzài, dõu
Yóu yigè bù nũiÌ de céngjing.
Bức thư viết cho chính mình số 009

Bạn bây giờ là kết quả của những hành động ngày trước tạo nên. Nếu bạn ghét
bản thân của hiện tại thì càng nên ngẫm lại và xem lại mình. Bởi vì, mỗi điều ở hiện

tại mà bạn không hài lòng đều có cùng nguyên nhân: Do trước kia bạn cố gắng và nỗ
lực chưa đú.





Niánging zhèng shì chikủ de shfhòu, zhèng shì fafèn núlì de shíhòu. NĂ yidìng vào
+
xianpxìn, mẽi yigè fafèn nủì de bèihòu, bì yðu Jiabèi de JiăngshĂäng. Jintian de shenghuó shì
yÓóu san nián gián Juédìng de, dànshì rúguð nĩ jintan háiguòzhe hé sản nián gián yIyàng de
shenghuó, nàme san nián hòu de nử réng jiàng rúcÏ.
Bức thư viết cho chính mình số 010
Tuối trẻ chính là lúc nếm trải cực khố, cũng chính là lúc chúng ta nỗ lực hết


10


"
4,"写给自己的第11封信
其实奋斗就是每天踏踏实实地过好日子，
做好手头的每件小事，
不拖
不抱怨、
每一天一点一滴的努力，
不偷懒。
不推卸、
才能汇集起千万
带着你的坚持，
勇气，
引领你到你想要到的地方去。
写给自己的第12封信
每一个努力的人都能在岁月中破茧成蝶，
有一天你将破蛹
你要相信，
而出，
但这个过程会很痛，
成长得比人们期待的还要美丽，
会很辛苦，
有
时候还会觉得灰心。面对着汹涌而来的现实.是生命的一部分。做好现在你能做的，然后，
时候还会觉得灰心。
觉得自己渺小无力，一切都会好起来。
但这也
","
mình. Bạn nhất định phải tin rằng: Đằng sau những nỗ lực kia cần có thêm sự động

viên. Cuộc sống của ngày hôm nay là do ba năm trước quyết định. Nhưng nếu hôm
x ..
B
nay bạn vẫn sống cuộc sống của ba năm trước thì bạn của ba năm sau vẫn cứ như thế

ˆ ..


mà thôi.
_













... .
i
Qíshí fèndòu Jiùshì mẽitãn tà tàshí shídìguò hão rìzi, zuò hãăo shðutóu de mẽi jiàn
- ..


xiÄoshì, bù tuola, bù bÀoyuàn, bù tuÂxiè, bù toulăn. Mẽi yiuãn yĩ diễn yĩ dĩ de nùh, cáinéng
huìjÍ qš gian wàn yónggì, dàizhc nÍ de jianchí, vĩnlĩng nĂ dào nặ xiăng yào dào dì dừãng qù.


Bức thư viết cho chính mình số 011


Có một khái niệm: Phấn đấu chính là bình thản sống mỗi ngày, làm thật tốt những
việc bản thân đang phải làm, không trì hoãn, không than phiền, không thoái thác và
không lười biếng. Mỗi ngày cố gắng thêm một chút một chút mới có thể gộp thành

ngàn vạn dũng khí, mang theo sự kiên trì, dẫn bạn đến những nơi bạn muốn đến.







⁄ `
Mẽi yigè nũlì de rén döu néng zài suyuè zhöng pò jiăn chéng dié, nĂ vào xiangxìn,
yÖu yitian n jiang pÒ yóng ér chu, chéngzhăng dé bÌ rénmen gídài de hái vào mẽtlì, dàn
zhègøe guòchéng huì hšn tòng, huì hền xinkúù, yóu shíhòu hái huì juédé huïxin. Miàn duìzhe
`v

xiongvóng ér lái de xiànshí, Juédé zìjÏ miÄoxišo wúlì, dàn zhè yšshì shengming de yibùfèn.
Zuò hão xiÀnzài nỗ néng zuò de, ránhòu, yigiè duhuì hằo dhlái.
Bức thư viết cho chính mình số 012

Trong cuộc sống của mình, mỗi người biết cố gắng và nỗ lực đều có thể từ
nhộng hóa bướm. Bạn cần tin rằng, một ngày nào đó, bạn sẽ phá chiếc vỏ nhộng để

chui ra, trở lên đẹp đẽ hơn tất thảy những gì mong đợi. Nhưng quá trình này sẽ rất
đau đớn, sẽ rất khổ sở, và lắm lúc còn làm bạn nản lòng. Đối diện với những hiện thực
đầy sóng gió, đôi khi bạn sẽ cảm thấy bản thân mình lực bất tòng tâm. Nhưng đây
rx x
cũng là một phần của cuộc sống. Hãy làm tốt những thứ mình có thể làm, rồi sau đó,
tương lai sẽ xử lí phần còn lại, mọi thứ sẽ tốt lên thôi!
lài



"
5,"写给自己的第13封信
难免都会有一段黯淡的时光。
每个成功的人在成功之前，
你无
此时，
只需努力朝着自己的目标大步迈进，
须害怕，
然后再付出强
也无须胆怯，
于以往三倍的努力，
你一定会超越现在的自己。
若干年后，
写给自己的第14封信
不责难，
不断努
都会有一段沉默的时光，
每一个优秀的人，
不抱怨、
坚信在黑暗中也能盛开出最好的花。
忍受着黑夜的孤独与寂寞，
写给自己的第15封信
完全没有必要因为你的衣服不如别人，
你现在还很年轻，
包不是名
因为每一个人都是这样过来的，
或者存款还不到五位数而觉得不安。
你自己才是一切的根源，
首先要改变自己！
要想改变人生，
","
.v
`

Mễẽi gè chénggong de rén zài chénggong zhigián, nánmiăn duhuì yÓu yiduàn àndàn
de shíguang. Cĩï shí, nă wrúxu hàipà, yš wúxu dăngtè, zhỉ xu núlì cháozhe zìï de mùbiao dà
bù màijìn, ránhòu zài fùchu qiáng yú yÌwăng sản bèi de nũlÌ, ruògan nián hòu, n yidìng huì
chaoyuè xiànzài de zìji.
Bức thư viết cho chính mình số 013

Những con người thành công trước khi bước đến bục vinh quang, không thể
tránh khỏi có những thời điểm vô cùng mờ nhạt. Những lúc như thế, bạn không cần
L : ~ . ` '›J ~ # x ? a . 7 I I, ? x ~ 4 ~ z MA
hải sơ hãi ø] cả, cũng chắng cần phải nhụt chí e ngại, chỉ cần cốổ gắng vững bước về
phía mục tiêu, sau đó lại dốc sức gấp ba gấp bốn so với những gì mình đã bỏ ra, có thể
chỉ vài năm sau, bạn chắc chắn sẽ vượt qua bản thân “mờ nhạt” ở hiện tại.

Mềi yigè yOuxiù de rén, duhul yóu yiduàn chénmò de shíguang, bù bÀoyuàn, bù zénàn,
bùduàn nũi, ršnshòuzhe h&iyè de gũdú yù jìmò, jiãnxìn zài helàn zhõng yẽ néng shèngkãi
chũ zuì hăo de huã.

Bức thư viết cho chính mình số 014
Những người thành công đều có thời điểm chịu đựng trước tất cả, không than
phiền, không oán trách, không ngừng cố gắng, một mình chịu đựng sự cô đơn lẻ loi.
trong đêm, và vẫn vững tin rằng, dù ở trong bóng tối mù mịt, hoa vẫn có thể bung nở
Tực rỡ.



X,

NI xiànzài hái hền niánqing, wánquán méiyÖu bìyào yinvzèi nằ de yiưú bùrú biếrén,
báo bùshì míngpái, huòzhš cúnkuăn hái bù dào wÙ wèi shù ér Juédé bù ãn. Yĩnwèi mẽi yigề
tén döou shì zhèyàng guÒlái de, nằ z}jï cái shì yigiè de genyuán, yào xiăng găibiàn rénsheng,

shöuxian vào găibiàn zìj†!



12




"
6,"写给自己的第16封信
也不能保证你人生的棋局会步步顺畅，
纵使你天生就拿到一副好牌，
也未必能保证你在生活的博弈中稳操胜券。
要靠自己步步
好的人生棋局，
为营，
努力去争取。
写给自己的第17封信
所有的成功，奋斗和坚持，你无
成功，都来自于不倦的努力和奔跑；你无法找到捷径。
所有幸福，都来自平凡的
写给自己的第18封信
你还在挣扎再多睡几
你在睡觉；别人已经起床，
别人在熬夜的时候，
别人却一件事坚持到底。
你有很多想法，
你连
但脑袋热了就过了，
分钟。
","ũ
Bức thư viết cho chính mình số 015


Bây giờ bạn vẫn còn rất trẻ, cho nên đừng có vì quần áo của mình không đẹp

bằng người ta, túi xách chẳng phải hàng hiệu và tiền tiết kiệm không đủ nối 10 triệu
mà cảm thấy lo lắng. Vì mỗi người ai cũng phải trải qua những lúc như thế. Chính bản
thân bạn là nguồn gốc của tất thảy, muốn thay đổi thế giới này thì trước tiên bạn phải
thay đối chính bản thân mình.










Zòngshi nỉ nãnsheng iù ná dào yt fù hão pái, yễ bù1:1c'=,1`1g băozhèngnỉ rénshengde qfjú huì
bù bù shùnchàng, yš vrèibì néng băozhèng nỉ zài shenghuó de bóyì zZhong wẽncAaoshèngquàn.
Hão de rénsheng qfjú, vào kào zìJï bùbùwéiyíng, nũlì qù zhengqù.


Bức thư viết cho chính mình số 016

Cho dù khi bạn sinh ra có ngay một tấm thẻ bài vận mệnh cực đẹp thì cũng

không thếể đảm bảo đời bạn cứ sẽ thế mà thuận buồm xuôi gió. Tấm thẻ bài này càng
không đảm bảo rằng trong trò chơi cuộc đời bạn sẽ nắm chắc phần thắng. Cục diện
cả ván cờ trăm năm này muốn tốt đẹp đến cuối trận, ắt phải tự mình suy tính từng
x si


nước đi một, nỗ lực phấn đấu bằng tất cả trí óc để tranh đấu mà giành phần chiến
thắng huy hoàng.

















—






SuðyÖu de chénggong, dou láizì vú bù Juàn de nủiì hé benpšo; suöyðu xìngfú, dou 1áizì
píngfán de fèndòu hé jiãnchí, nÏ wúfš zhšodào jiéjìng.
x .vx.
Bức thư viết cho chính mình số 017


Tất thảy sự thành công đều đến từ những nỗ lực không mệt mỏi; hạnh phúc

cũng thế, đều đến từ những sự kiên trì và cố gắng rất bình thường. Bạn không thể tìm
được một con đường nào ngắn hơn nữa đâu.






13

ũ
"
7,"肯定也不能早晨起来背单
一本书都要看很久，
该工作的时候就刷起手机，
晚上加班到深夜。很多时候不是你平凡，b
而是你没有别人
碌碌无为，
付出得多。
一
写给自己的第19封信
谁都不可
每个人都有自己的生活，
当一个人忽略你时，
不要伤心，-
最尴尬的莫过于高估自己在别人心里的位置，一
能一直陪你。
其实你明明知
最卑贱不过感情，
有的东西就像
就是你的。
最凉不过人心。
是你的，
努力了，
就会流失得越快。
其他
珍惜了，
越是紧握，
手中沙，
问心无愧。
交给命运。
","
3%Ị,

Biếrén zÀài áoyè de shíhòu, nă zài shuìjiÀo; biérén y¡ng gÍchuáng, nÏ hái zài zhengzhá zài
duõ shuì Jï fenzhong. Nă yÓu hễnduoö xiăngfã, dàn năodai rèle jiùguòle, biếrén què yĩ Jiàn shì

jiãnchí dàodĩ. Nĩ lán yĩ bến shũ döu yào kàn hšnjiÙ, gãi gõngzuò de shfhòu jiù shuã gì shốujï
kẽndìng yẽ bùnéng zăochén gñlái bèi dancí, wšnshàng Jjiaban dào shenyè. Hšnduo shíhòu
bùshì nÏ píngfán, lùlù wúwéi, ér shì nẴ mếiyÓu biếrén fùchu dề duo.
Bức thư viết cho chính mình số 018


Lúc người ta thức đêm thì bạn say giấc nồng, lúc người ta tỉnh giấc thì bạn vẫn
còn “lăn lộn” qua lại để ngủ thêm mấy phút. Bạn có nhiều ý tưởng nhưng chỉ cần
căng thẳng một chút là bỏ đi hết, còn người ta dù chỉ đang làm một chuyện rất nhỏ
thì vẫn cứ kiên trì đến cùng. Bạn xem một cuốn sách thì “mất cả thế kỷ” lúc cần làm
việc thì ngồi lướt Facebook, chắc chắn là bạn chẳng thể dậy sớm mà học thuộc từ mới

hay cũng chẳng thể nào có sức tăng ca đến đêm muộn. Không phải bạn tầm thường
không thể làm được, mà là vì bạn chẳng chịu bỏ công bỏ sức đủ nhiều như những
``..
người bình thường khác.



t,
”“,

dang yigèrén huluè n shí, bùyÀo shãngxin, mẽi gè rén döu yóu zìjÝ de shenphuó, shới
döou bù kẽnéng yizhí péi nặ. Zuì gangÀ de mò guòyú gao gũ zìJÏ zài biếrénxInlì de wèizhì, gíshí


n míngmíng zhidÀo, zuì beljiàn bùguÒ găngÍíng, zuì Háng bùguò rén xin. Shì nặ de, jiùshì nỉ
de. Yöu de dongxi jiù xiàng shðuzhöng shã, vuè shì lïn wÒ, liù huì liúsh1 đề vuê kuải. Núhle,
zhenxiliÃo, wènxin wúkuiì. Qíta de, jiao gẽi mìngyùn.

Bức thư viết cho chính mình số 019
Khi có ai đó coi thường bắt nạt bạn, bạn không cần phải đau lòng, mỗi người
ai cũng có cuộc sống riêng của mình, không ai có thể suốt đời ở bên bạn được. Điều
đáng lo nhất chính là việc tự nghĩ rằng mình có một vị trí đặc biệt trong lòng người
khác. Thực ra chúng ta đều hiểu rằng, thứ nhỏ bé nhất chính là tình cảm, thứ lạnh
lùng nhất chính là lòng người, cái gì là của bạn thì nó sẽ phải là của bạn. Có những
thứ tựa như cát trong tay, càng nắm chặt thì càng dễ mất đi. Đã cố gắng rồi, trân trọng

rồi, bản thân tự thấy không hổ thẹn là được rồi. Mọi thứ khác, bạn hãy để số phận

quyết định!

14




"
