src_id,cn_text,vi_text
46,"写给自己的第121封信
因为普通人承受不了的委
伟大都是熬出来的。
为什么用熬?
冯仑说，
普通人以消极指责来
普通人需要别人安慰鼓励，
但你没有；
屈你要承受，
在任何事情上学会自我解嘲；
普通人需
发泄情绪，
但你必须看到爱和光，
而你就是别人依靠的肩膀。
要一副肩膀在脆弱的时候靠一靠，
写给自己的第122封信
总会有人因为种种原因向你
都不可能被所有人接纳，
任何人这辈子，
将职场较量变
己，恨不得将你排挤出局。与其跟他们较劲，将职或想尽方法博得他们的喜欢，还不如静下心来，
恨不得将你排挤出局。
投来敌视的目光，
先将该做
成一场宫斗戏，
让自己拥有可以无视那些挑衅的力量。
的事情做好，
","



Fénglún shuöo, wẽidà du shì áo chulái de. Weèishéme yòng áo? Vinwèi pủtong rén
chéngshòu bùliăo de wẽiqu nÍ yào chéngshòu, pủtong rén xuyào biếrén anwèi gủiÌ, dàn nử
méiyÓu; pũtong tén yÏ xiaojí zhïzé lái faxiè gíngxù, dàn n bìxu kàn dào ài héguang, zài rènhé

shìqíng shàng xuếhuì zìwó jiễcháo; pútong tén xuyào yĩ fù jianbăng zài cuìruò de shífhòu kào
ytkào, ér n jiùshì biếrén yĩ kào de Jjianbăng.

Bức thư viết cho chính mình số 121
Tác giả Phùng Luân từng nói: Những người vĩ đại đều do tôi luyện mà thành!
Nhưng tại sao lại cần tôi luyện? Bởi vì bạn phải chịu đựng những ấm ức mà người
bình thường không thếể chịu được, người bình thường có sự an ủi cổ vũ mà bạn không

có, người bình thường có thể chỉ trích một cách tiêu cực đế xả cơn giận nhưng bạn
buộc phải thấy tình yêu và ánh sáng. Bạn còn phải học cách tự cười nhạo bắn thân

trong bất kì trường hợp nào còn người bình thường có thế dựa vào vai người khác
những lúc yếu đuối. Những lúc đó có khi bạn chính là bờ vai cho người khác tựa vào.



Rènhé rén zhè bèizi, döu bù kšnéng bèi suöyðufén jienà, zóng huÌ yÓu tén yinwèi

zhòngzhồng yuányïn xiàng nÏ tóu lái díshì de mùguãng, hènbudé jiãng nĩ páiji chũjú. Vũqí gẽn
tamen jiÀojìn, jiang zhíchăng jiàolàng biàn chéng yĩ chăng gong dòu xì, huò xiăng jïn fangfš
bódé tamen de xÏhuãn, hái bùrú jìng xiÀxin lái, xian jiang gãi zuò de shìqíng zuò hão, rằng zìjï
yóngyöu kẽy! vrúshì nàxie tĂoxìn de hhàng.

Bức thư viết cho chính mình số 122

Bất kì ai trong cuộc đời đều không thể được tất cả mọi người chấp nhận. Kiếu.

gì cũng có ai đó vì vô vàn lí do mà ném cho bạn ánh mắt thù hận rồi chỉ mong đá bạn
ra khỏi cuộc đời. Thay bằng việc cạnh tranh với họ bằng cách biến nơi làm việc thành
đấu trường hoặc nghĩ mọi cách khiến bọn họ thích bạn, chi bằng hãy tĩnh tâm lại, làm
tốt mọi chuyện nên làm trước tiên, khiến bản thân có thể bỏ qua sự khiêu khích của
mọi người mà an nhiên tận hưởng cuộc sống.


53


"
47,"写给自己的第123封信
你也不必在乎
最好的办法是谁不在乎你，-----
你无法满足所有人的眼光，
自己是怎样继续怎
不必为别人的一两句话就改变自己对自己的看法，
只是为了自己。
你的努力，
写给自己的第124封信
我们无法逃避敌人的存在，
却
生活本就不是一次化敌为友的历程，
可以在知难而上中增强自己的力量，
你的存在自有道
并最终让他们承认，
只要你足够优秀，
全世界的人都会发自肺腑地为你鼓掌。
写给自己的第125封信
谁不曾经历过让自己难过的事情?
难过、
伤心都是人生
漫长的一生，
无法绕过的坎坷，
人才慢慢成熟起来。
纠结过，
经历过，
最怕的是一直停
陷在让你难过的境遇中不可自拔。
留在过去，
之所以这样，
大部分原因是
你意志薄弱，
内心不够强大。
","
b
B
Nĩ wúfš mănzú suöyÖu rén de yănguang, zuì hăo de bànfã shì shéi bùzÀthu nử, rử
yš bùbì zàihũ tã. Bùbì wèi biếrén de yĩ lăng jù huà jiù găibiàn zỳjšï duì zìjš de kànfã, zìjƒ shì
zšnyàng Jjìxù zšnyàng, n de nùÌì, zhïshì wèile zìJ[.
Bức thư viết cho chính mình số 123

Bạn không có cách nào đế thỏa mãn tất cả cách nhìn của mọi người. Cách tốt
nhất là ai không quan tâm đến bạn thì bạn cũng không cần quan tâm lại. Đừng vì một
hai câu nói của người khác mà thay đổi cái nhìn về chính mình. Bạn như thế nào thì
hãy tiếp tục sống như thế và những nỗ lực của bạn chỉ vì dành cho chính bạn mà thôi.





z

- Z v ... ` ` - `N ` Z Z* v 4 v v Z 4
Shenphuó bền nù bùshÌ yicì huà dí wéi yÖu d H""chéng, wðmen x/ôfš táobÌ đírên de
cúnzÀi, què kếyï zài zht nán ér shàng zhöng zenggiáng zÙš de hhàng, bìng zuìzhong ràng
tamen chéngrèn, n de cúnzài zì yÖu dàoh. Zhšyào n zúgÒu youxiù, quán shìùjiè de rén duhulì

fa zì tèfũ dì wét n gũzhăng.


Bức thư viết cho chính mình số 124

Cuộc sống chính là hành trình hóa kẻ thù thành bạn bè. Chúng ta không thể
tránh khỏi sự tồn tại của kẻ thù mà chỉ có thể tăng cường sức mạnh của bản thân khi

phải đối diện, để đến cuối cùng họ buộc phải thừa nhận rằng sự tồn tại của bạn có ý
nghĩa riêng và đặc biệt. Chí khi bạn đủ xuất sắc thì cả thế giới này mới có thể vỗ tay
ca ngợi bạn từ tận đáy lòng.


—



Màncháng de yisheng, shéi bùcéng Jinglìguò ràng ZÌjŸ nánguò de shìqíng? NánguÒ,
]
shangxin döu shì rénsheng wúfĂ ràoguÒ de kănkế, ]inglìguÒ, JiujiếguÒ, réncái màn man
54



"
48,"写给自己的第126封信
我们控制不了;
闭上眼睛，
别人想什么，
安静内心告诉自己。
别人做
我们也强求不了。
就是尽心尽力做好自己的事，
走
唯一可以做的，
什么，
时间也不会亏
即使有人亏待了你，
按自己的原则，
自己的路，
好好生活。
待你，
人生更加不会亏待你。
写给自己的第127封信
其
等你登上顶峰会发现，
不要自降身价迎合人，
全力以赴往前走吧，
实在非议你的人背后，
还有更多爱你的人。
往往是沉默的
因为爱你的人，
大多数。
","

chéngshú gllái. Zuì pà de shì yĩzhí tíngliú zài guÒqù, xiàn zài rÀng nĂ nánguò de Jìngyù zhong

bùkš zìbá. Zhĩ suỏyÏ zhèyàng, dà bùfèn yuányï shì nặ yìzhì bóruò, nèixin bùgÒu qiángdÀ.

Bức thư viết cho chính mình số 125

Trong cuộc đời dài dằng dặc này có ai là chưa từng trải qua những chuyện đau
buồn chứ? Buồn hay đau lòng là những chướng ngại trong mỗi cuộc đời mà ta không



thế tránh được. Chúng ta phải trải qua, dằn vặt vì nó thì mới dần dần trưởng thành

lên được. Điều đáng sợ nhất chính là bạn mãi mãi dừng lại ở quá khứ, đắm chìm
trong nỗi buồn mà không thể dứt ra được. Nguyên nhân của việc này chính là do bạn

có ý chí quá bạc nhược cùng nội tâm kém mạnh mẽ.






Bì shàng yănjing, 2njìng nèixIn gàosù zìjï. Biérén xiăng shénme, wömcn kòngzhì bùlião;
biérén zuò shénmc, wómen yš giăngqiú bùlĂo. Wéiyi kẽyÏ zuò de, JiùshÌì Jìnxin Jình zuò hão
zìjš de shì, zóu z}jš de là, àn zìJš de yuánzé, hăo hào shenghuó. ]íshÍ göurén kuidAile nš, shfian

yễ bù huì kuidài nử, rénsheng gèngjia bù huì kmdài nỉ.


Bức thư viết cho chính mình số 126





Nhắm mắt lại để trái tim im lặng mà tự nhủ với bản thân rằng: Người khác nghĩ

gì ta không điều khiển được, người khác làm gì ta cũng không cưỡng ép họ khác đi
được. Điều duy nhất ta có thể làm là dốc hết sức làm tốt việc của bản thân, đi trên
con đường của mình, sống tốt theo nguyên tắc đã đặt ra từ trước. Cho dù người khác

`
l
* ˆ
có đối xử tệ bạc với bạn thì thời gian cũng như cuộc đời cũng sẽ nhất định không đối
xử tệ với bạn.


Bùyào zì Jiàng shenjià yínghé rén, quánh vÏ fù wšng gián zóu ba, dễng n deng shàng
dngfeng huì faxiàn, qíshí zài felyì n de réên bèihòu, hái yÓu gèng duo ài nÍ de rén. Ÿinvgèi ài
n de rén, wăngwăng shì chénmò de dà duoshù.

55


"
49,"写给自己的第128封信
人脉也不是追求来的，
而是吸引
如果你不够优秀，
人脉是不值钱的，
虽然听起来很冷，
只有等价的交换，
但这是
才能得到合理的帮助。
来的。
而藏在自己身上：
人脉不在别人的身上，
唯有让自己变得强大，
你
事实！
不如花时间提高自
与其把时间花在多认识人上面，
才能获得有用的人脉！
己的个人价值
写给自己的第129封信
如果有人伤害了你，可以原谅他，但不要，而盲目信任却只会给他再伤害你的机会。
但不要再轻易相信他。原谅是放过
可以原谅他，
自己，
","Bức thư viết cho chính mình số 127
Đừng hạ thấp giá trị bản thân để phù hợp với người khác mà hãy dồn toàn lực
tiến về phía trước. Đợi đến một ngày bạn đứng trên đỉnh cao danh vọng, bạn sẽ phát
hiện ra rằng: Thực ra đằng sau những người chỉ trích bạn vẫn còn rất rất nhiều người
yêu bạn. Bởi đơn giản thôi, đa số những người yêu bạn đều âm thầm và lặng lẽ.




Rúguð ní bùøgòu youxiù, rénmài shì bù zhíqián de, rénmài yš bùshì zZhutgiú lái de, ér shì
xiyin lái de. ZhĩyÖu dẽng jià de Jiaohuàn, cáinéng dédào hélñ de bangzhù. Suirán tíng gilái hền

lễng, dàn zhè shì shìshít Rénmài bùzài biếrén de shenshang, ér cáng zài zìJš shenshang: Wéi
yóu ràng zìJš biàn dé qiángdà, nĂ cáinéng huòdé yöuyòng de rénmài! Yúqí bă shíjian hua zài

duo rènshì rén shàngmiàn, bùrú hua shíjian tígáo zÌjÏ de gèrén JiÀzhí.
Bức thư viết cho chính mình số 128
1NCU i111U1 17cgLii 1S41ÄUÂj‡2 LiILIU 25CL ZAUL1CL 2CII LiAI V{VLCHẢI 15Ä VOAI E7CIEi Á LiAki, AxáiÂ/á Ea VỀCtAi C CgÃh
gì. Quan hệ không phải bạn cứ theo đuổi là được và phải do bạn thu hút được. Chỉ có
sự trao đổi đồng giá mới có thể đối lại sự giúp đỡ hợp tình hợp lí. Tuy nghe có vẻ tàn
nhẫn nhưng đó là sự thật không thể phủ nhận. Quan hệ không ở người khác mà được
ẩn chứa trong chính bạn. Chỉ khi bạn trở nên tài giỏi bạn mới có được những mối
quan hệ hữu ích. Thay vì lãng phí thời gian làm quen người khác chi bằng bạn dành
thời gian nâng cao giá trị bản thân.





Rúguð yðöurén shänghAile nĩ, kšyï yuánliàng tã, dàn bùyào zài qïngyì xiãngxìn tã.
Yuánliàng shì fàngguÒ ZÌjÄ, ét mángmù xìnrèn què zhĩ huì gẽi ta zài shanghài n de jhui.

Bức thư viết cho chính mình số 129

Nếu như có người làm tốn thương bạn, bạn có thể tha thứ cho anh ta nhưng

đừng bao giờ dễ dàng tin tưởng anh ta. Tha thứ là bỏ qua cho bản thân còn tin tưởng
một cách mù quáng chính là tạo cơ hội cho người ta làm tốn thương bạn thêm một
lần nữa.

⁄

56
"
50,"写给自己的第130封信
他们知道自己真
能够发现自己的不足并勇敢改变自己的人是幸运的，
正想要什么，
而且得到了自己想要的生活。很少有人能一步就拥有自己想
也许我们要走了很长一段时间的弯路，
但这有什么关系呢?
要的生活，
就
像在夜路中行走，你收获了满天闪亮的星星，
磨炼了心性。
写给自己的第131封信
这就是我，
我也不完美，
我永远不够好，
有时欢
可这又有什么呢?
有时包容，
有时懒散，
有时脆弱，
有时伤感，
有时坚强，
有时奋进，
但我一直走在更好的路上。
有时不屑，
写给自己的第132封信
那可能意味
可能就有多少人讨厌你。
有多少人喜欢你，
没人讨厌你，
往往会让喜欢与讨厌的人泾渭分明。
着你没什么可取之处。
鲜明的个性，
","



Nénggòu faxiàn zìJš de bùzú bìng vðnggăn gãibiàn zÌjÏ de rén shì xìngyùn de, tamen
zhidào zìJÏ zhenzhèng xiăng vào shénme, érqiš dédàole zÙJjÏ xiăng yào de shenghuó. Hẽn shăo
yöurén néng yibù Jiù yðngyðu zÌJÏ xiăng yào de shenphuó, yẽxủ wðmen yào zöule hền zhẳng
yiduàn shíjian de wanlù, dàn zhè yÖu shé me guanxì ne? Jiù xiàng zài yè lù zhöong xíngzÖu, nĩ
shöouhuòle măn tian shăn hàng de xingxing, móliànle xinxing.

Bức thư viết cho chính mình số 130



Người biết được mình không hoàn hảo và có dũng khí thay đối bản thân là
người vô cùng may mắn. Họ biết rõ bản thân thực sự cần gì, hơn nữa còn đạt được

cuộc sống mà mình mong muốn. Rất ít người một bước mà có được cuộc sống mà

mình mong muốn. Có thể chúng ta phải đi một đoạn đường rất dài, rất lòng vòng,

nhưng thế thì đã sao? Giống như bạn đi trong đêm khuya, tưởng chừng vô thưởng
—- ~
vô phạt nhưng thực ra bạn thu được cả bầu trời sao sáng và rèn luyện được tâm tính
của bản thân.

&
=

Y



W yóngyuăšn bùgòu hão, wð yš bù vránmẽi, kš zhè yòu yóu shé me ne? Zhè Jiùshì wö,
yóushí huanxÏ, vóushí shangošn, vöushí fènjìn, göushí lšnsăn, yöushí Jiangiáng, vöushí cuìruÒò,

yöushí baoróng, vöushí bùxiè, dàn wö y1zhí zóu zài gèng hão de lùshàng.


. Bức thư viết cho chính mình số 131





Tôi luôn không đủ tốt, không đủ hoàn hảo, nhưng như thế thì có sao cơ chứ?
Đây chính là tôi, có lúc vui vẻ, có lúc buồn chán, có lúc hăng hái phấn đấu, có lúc lười
biếng, có lúc kiên cường, có lúc yếu đuối, có lúc bao dung, có lúc khinh bỉ, nhưng tôi


vẫn đang đi trên con đường ngày càng tốt đẹp hơn.


57


"
51,"很少有人愿意去踢一只死狗。
这就是人性。优秀必然会引发嫉妒，
你要做
若你停下企图拼命对他们证明自己，
的就是继续前行，
那你将丢失原本属
于自己的风景
写给自己的第133封信
你就会恍
钱包里都是自己努力赚来的钱的时候，
当你又瘦又好看，
哪有时间患得患失，
哪有时间揣摩别人。
哪有时间猜东猜西，
然大悟，
不
这就是你的底气。
蝴蝶自来；
你若盛开，
有自尊，
迷茫，
你若精
不依附，
天自安排。
写给自己的第134封信
便要学会寡言，
喜怒不
每一句话都要有用，
有重量。
到了一定年龄，
有自己的底线。
形于色，
大事淡然，
","

Xõu duoshăo rén xÏhuan nă, kẽnéng ]iù yÓu duoshäo rén tăoyàn nằ. Méi rên tãoyàn rÏ,

nà kšnéng vìwèizhe n méishénme kẽqủ zhĩ chù. Xianmíng de gèxìng, vgăngwăng huì ràng
xThuan yùủ tăoyàn de rén jingwèlfenmíng. Zhè jiùshì rénxìng. Youxiù bìrán huì yïnfa Jídù, hền
M
shšo yöurén vuànyÌì qù t yĩ zhí sĩ gòu. NĂ yào zuò de JiùshÌ JìÌxù gián xíng, ruÒ nỉ tíng xiÀ gìtú
pinmiìng duì tamen zhèngmíng z}JjÌ, nà nĩ jiang diush1 vuánbẽn shủyú zÙÏ de fengjing.
Bức thư viết cho chính mình số 132

Có bao nhiêu người thích bạn thì khả năng cũng có ngần ấy người ghét bạn.
Không ai ghét bạn có thể do bạn chẳng có gì thu hút cả. Một cá tính rõ ràng có thể
khiến cho những người thích mình hay ghét mình phân biệt rõ rệt. Đó chính là cái
được gọi cá tính riêng. Một người tài giỏi đương nhiên sẽ bị ghen tị. Hầu như chắng
có ai thích thú với việc ghen tức với những người kém cỏi hơn mình. Những gì bạn


cần làm là cứ tiếp tục tiến về phía trước. Nếu như bạn dừng lại chỉ để chứng minh
bản thân với người đời thì bạn đã đánh mất những gì nguyên bản thuộc về mình.








52
⁄


Dãng nỉ yòu shòu yòu hăokàn, giánbao H döu shì zìJï nũlì zhuàn lái de gián de shíhòu,
m
rử jiù huì huặngrándàwù, nă yöu shíjian huànd@huànshi, nă yðu shíJian cai dong cai x1, n yÓu
shíilan chušimó biếrén. Bù mímáng, bù yIfù, yÖu zìzun, zhè Jiùshì nš de dïq]. Nï ruò shèngkãi,
húdiề zì lái; n ruò JImgcäi, tan zÌ anpát.


Bức thư viết cho chính mình số 133
Khi bạn vừa gầy lại xinh đẹp, trong ví đều là tiền do bản thân nỗ lực kiếm được,
bạn mới ngộ ra rằng bạn làm gì có thời gian để tính toán được mất, để đoán này đoán
nọ, để phán xét người khác chứ. Giới hạn của bạn chính là không mù quáng, không
dựa dẫm và có tự tôn riêng. Khi “bông hoa” của bạn nở rộ, bươm bướm sẽ tự bay đến.
Khi bạn nối bật, trời sẽ sắp đặt an bài.




58

"
52,"写给自己的第135封信
每一天都会告诉自己要好好控制情绪，
谨言慎行，
这不是将
不抱怨，
凡事不以恶意揣度别
而是在慢慢地提升自己。
自己变得懦弱和没有性格，
这是对自己最基
不妄自菲薄，
不以私利给他人添堵，
也不诋毁他人，
本的要求。
写给自己的第136封信
因为人们只会挑软柿子捏，
人不能太善良，
有一天你会明白，
如果
对
有时候应该适当有点脾气，
事事都太大度和宽容，
别人也不会感激你，
因过分善良会让我们丢失自己的价值和尊
待有些人真不能太温柔和忍耐，
过分善良也是一种傻。
严
","Dàole yrdìng niánlíng, biàn yào xuéhui guăyán, mẽi yĩJù huà döu vào yðuyòng, yðu
zhòngliàng. Xĩ nù bù xíng yú sè, dàshì dànrán, yðu zìJï de dïxiàn.


Bức thư viết cho chính mình số 134
Đến một độ tuổi nhất định bạn phải học cách nói ít đi nhưng mỗi lời nói đều có
Ích và có trọng lượng. Bạn không cần thể hiện rõ sự vui buồn. Hãy đối mặt với chuyện
lớn một cách thản nhiên và có giới hạn của bản thân mình.




Ẩ
Mặẽi yItan duhul gàosù zìjï vào hăohão kòngzhì qíngxù, bù bàoyuàn, jÍn yán shèn xíng,

zhè bùshì jiang zìjš biàn dé nuòruò hé mềéiyÖu xìnggé, ér shì zài màn man de tísheng z)jÌ.
7 i 7 b cc2 z c 7
Fánshì bù yï èyì chušiduò biếrén, bù yÏ sĩlì gẽi tãrén tiãnd, bù wràngzìfšibáo, yẽ bù dïhuï
tãrén, zhè shì duÌ zìjï zuì jbšn de yãoqlú.

Bức thư viết cho chính mình số 135



Ngày nào cũng tự nhủ với bản thân rằng phải khống chế cảm xúc của bản thân,
không oán hận, cẩn trọng trong lời ăn tiếng nói. Đây không phải cách khiến bạn trở
nên yếu đuối, không có tính cách mà đang dần nâng cao vị thế của bản thân. Trong

mọi chuyện không được tuỳ tiện ác ý phán đoán người khác. Đừng vì lợi ích của bản

thân mà gây phiền phức cho người khác, không tùy ý phỉ báng người khác và không

vu oan người khác, đây là những yêu cầu cơ bản nhất dành cho bản thân của bạn.











2
Yðu yitan n huì míngbái, rén bùnéng tài shànliáng, yĩn wéi rénmen zhỉ huì tiao ruấn
shìzi nie, rúgu shì shì dou tài dà dù hé kuanróng, biếrén yš bù huì gănj! nằ, yvóu shífhÒu yingoai
shìdàng yöudiăn píqì, dudài göuxie réên zhen bùnéng tài wgenróu hé rềnnài, yĩn guòfèn shànliáng

huì ràng wÖmen diushi zìjï de JÀàzhí hé zunyán, guòfèn shànliáng vẽshì yt zhóng shã.




Bức thư viết cho chính mình số 136

Có một ngày bạn sẽ hiểu rằng, bạn không thế quá hiền lành bởi người đời chỉ
59




"
53,"写给自己的第137封信
我们就尽力好了，
每个人都会有自己的想法，
人生无法做到完美，
理
我们没必要去干涉别人，
甚至
念不同，
活法就不同，
做法不同，
影响别人，
攻击别人。他好，
不去鄙视。
不去打击，
不去报复；
不去嫉妒，
他不好，
写给自己的第138封信
当一棵树不再炫耀自己叶繁枝茂，
它才真正
而是深深扎根泥土时，
而是强大自己的內径
当一棵树不再攀比自己与天空的距离，
地拥有深度；
人的成长同样需要
它才真正地拥有高度。
树的生长需要深度和高度，
他的生命将变得真
而是照耀的时候，
深度和高度!
当一个人不再是炫耀，
正富有！
","có khả năng và chỉ biết bắt nạt những kẻ yếu đuối mà thôi. Nếu như chuyện nào bạn
cũng khoan dung và rộng lượng, người khác cũng không cảm ơn bạn đâu. Có lúc bạn
. phải tỏ ra tức giận, không thế đối xử quá dịu dàng và nhẫn nại với kẻ khác, bởi hiền
lành quá làm cho chúng ta mất đi giá trị và sự tôn nghiêm của bản thân. Hiền lành
quá đôi khi cũng là một dạng ngốc nghếch.

Rénsheng wúfä zuò dào wánmẽi, wömen jiù Jình hăole, mẽi gèrén duhul yðu zìJš de

xiăngfà, liniàn bùtóng, zuòfš bùtóng, huó fã jiù bùtóng, wvÓmen méi bìyào qù ganshè biếrén,
víngxiăng biếrén, shènzhì gõngjí biếrén. Tã hão, bù qù jídù, bù qù bào£à; tã bù hăo, bù gù
dšjf, bù qù bïshÌ.

Bức thư viết cho chính mình số 137
Cuộc đời không có gì là hoàn hảo cả, chúng ta chỉ có thế cố gắng hết sức mà thôi.
Ai cũng có suy nghĩ riêng của mình. Quan điểm không giống nhau, cách làm không
giống nhau và cách sống khác nhau nên chúng ta không cần phải can thiệp vào cuộc
sOng của IgườỜi Khác. Người ta có tốt thì cũng qừứng gắcnh t đừng các thủ, Người ta
không tốt cũng đừng công kích hoặc đừng khinh bỉ.

w”,
Dãng yĩ kế shù bù zài xuànyào z}JŸ yèfánzhi mào, ét shì shen shen zhágen nítủ shí, ta
cái zhenzhèng de vöngyðu shendù; dang vĩ kế shù bù zài panbi zìJï gủ tiãnkong de Jùlí, ér shì
giángdà zìJÏ de nèijìng shí, ta cái zhenzhèng de yðngyóu gaodù. Shù de shengzhăng xuyào
shendù hé gaodù, rén de chéngzhăng tóngyàng xuyào shendù hé gaodùi Dang yigè rén bù
zài shì xuànyào, ér shì zhàoyào de shíhòu, ta de shenpmìng Jiang biàn dé zhenzhèng fùyöul
Bức thư viết cho chính mình số 138
Khi cái cây không còn khoe khoang cành lá của mình nữa mà cắm rễ thật sâu

xuống lòng đất, cái cây đó mới thực sự gọi là vững chắc. Khi một cái cây không còn so
sánh khoảng cách của mình với trời xanh mà tập trung chăm sóc cho bộ rễ của mình,
60


"
